{
  "schema": "frank.evidence/v1",
  "changeId": "chg-456",
  "createdAt": "2026-07-28T12:00:00Z",
  "retentionPolicy": "release-history",
  "outcome": {
    "summary": "Capture now acknowledges durability before enrichment finishes.",
    "userImpact": "Saving a thought from your phone confirms in well under half a second, even when the network is slow."
  },
  "requirements": [
    "UX-004",
    "BUILD-006",
    "FRANK-\u00a75.3",
    "ADR-004"
  ],
  "source": {
    "repository": "git@github.com:stevenshelley58-afk/frank.git",
    "baseCommit": "a1b2c3d4e5f6a7b8c9d0e1f2a3b4c5d6e7f8a9b0",
    "headCommit": "b2c3d4e5f6a7b8c9d0e1f2a3b4c5d6e7f8a9b0c1",
    "changedFiles": [
      "modules/work/src/capture.ts",
      "modules/work/src/capture.test.ts"
    ],
    "lockfileSha256": "sha256:0000000000000000000000000000000000000000000000000000000000000001"
  },
  "execution": {
    "workflow": "build.change@1.4.0",
    "policy": "autonomous-internal-work@3.2.0",
    "environment": "sandbox-image@sha256:0000000000000000000000000000000000000000000000000000000000000002",
    "agents": [
      {
        "id": "agent/builder",
        "revision": "1.8.0",
        "harness": "codex@2026.07.1",
        "model": "provider-a/model-x@2026-06",
        "skills": [
          "build.implement@1.2.0"
        ],
        "tools": [
          "repo.write@1.0.0",
          "tests.run@1.0.0"
        ]
      }
    ]
  },
  "artifacts": [
    {
      "kind": "test-report",
      "uri": "s3://frank-evidence/chg-456/tests.json",
      "sha256": "sha256:0000000000000000000000000000000000000000000000000000000000000003"
    }
  ],
  "checks": [
    {
      "id": "unit",
      "result": "pass",
      "required": true
    },
    {
      "id": "types",
      "result": "pass",
      "required": true
    },
    {
      "id": "dependency-direction",
      "result": "pass",
      "required": true
    },
    {
      "id": "cross-model-review",
      "result": "pass",
      "required": true
    }
  ],
  "reviews": [
    {
      "reviewer": "agent/reviewer-independent",
      "kind": "correctness",
      "modelFamily": "provider-b",
      "isolatedContextHash": "sha256:0000000000000000000000000000000000000000000000000000000000000004",
      "reportHash": "sha256:0000000000000000000000000000000000000000000000000000000000000005",
      "verdict": "pass",
      "findings": []
    },
    {
      "reviewer": "agent/reviewer-security",
      "kind": "security",
      "modelFamily": "provider-c",
      "isolatedContextHash": "sha256:0000000000000000000000000000000000000000000000000000000000000006",
      "reportHash": "sha256:0000000000000000000000000000000000000000000000000000000000000007",
      "verdict": "findings",
      "findings": [
        {
          "severity": "low",
          "summary": "Capture acknowledgement path logs the source identifier at info level.",
          "evidence": "Reproduced by POST /capture with LOG_LEVEL=info; identifier appears in stdout.",
          "file": "modules/work/src/capture.ts",
          "line": 84
        }
      ]
    }
  ],
  "securityScan": {
    "tool": "dependency-audit@1.0.0",
    "result": "pass",
    "reportSha256": "sha256:0000000000000000000000000000000000000000000000000000000000000008",
    "unresolvedCritical": 0,
    "unresolvedHigh": 0
  },
  "risks": [
    {
      "summary": "Enrichment backlog can grow if the worker pool is saturated; capture stays durable but Today lags.",
      "severity": "low",
      "residual": true
    }
  ],
  "rollback": {
    "kind": "release-pointer",
    "target": "release-previous",
    "runbookId": "RB-REL-001@1.0.0"
  },
  "cost": {
    "currency": "AUD",
    "totalSpend": 2.41,
    "wallClockSeconds": 738,
    "runId": "run-789",
    "projectId": "frank-construction"
  },
  "integrity": {
    "manifestSha256": "sha256:0000000000000000000000000000000000000000000000000000000000000009",
    "signerId": "service/evidence",
    "signature": "ed25519:placeholder-signature-for-schema-example"
  }
}
